 324 240.061295834    10.0.2.15 → 10.0.2.4     TCP 74 44480 → 8888 [SYN] Seq=0 Win=64240 Len=0 MSS=1460 SACK_PERM=1 TSval=617091027 TSecr=0 WS=128
  325 240.061362819     10.0.2.4 → 10.0.2.15    TCP 74 8888 → 44480 [SYN, ACK] Seq=0 Ack=1 Win=65160 Len=0 MSS=1460 SACK_PERM=1 TSval=4118034593 TSecr=617091027 WS=128
  326 240.062091990    10.0.2.15 → 10.0.2.4     TCP 66 44480 → 8888 [ACK] Seq=1 Ack=1 Win=64256 Len=0 TSval=617091028 TSecr=4118034593
  327 240.062685531    10.0.2.15 → 10.0.2.4     OCSP 461 Request
  328 240.062706998     10.0.2.4 → 10.0.2.15    TCP 66 8888 → 44480 [ACK] Seq=1 Ack=396 Win=64768 Len=0 TSval=4118034595 TSecr=617091028
  329 240.063345961     10.0.2.4 → 8.8.8.8      DNS 93 Standard query 0x587e PTR 15.2.0.10.in-addr.arpa OPT
  330 240.084875763     10.0.2.4 → 8.8.8.8      DNS 88 Standard query 0xa48a A ocsp.digicert.com OPT
  331 240.085157983     10.0.2.4 → 8.8.8.8      DNS 89 Standard query 0x1e68 A cs9.wac.phicdn.net OPT
  332 240.085429454     10.0.2.4 → 8.8.8.8      DNS 88 Standard query 0xe8fb AAAA ocsp.digicert.com OPT
  333 240.085659128     10.0.2.4 → 8.8.8.8      DNS 89 Standard query 0x19df AAAA cs9.wac.phicdn.net OPT
  334 240.085835988     10.0.2.4 → 192.168.1.1  DNS 78 Standard query 0xb1cc AAAA cs9.wac.phicdn.net
  335 240.090779012  192.168.1.1 → 10.0.2.4     DNS 146 Standard query response 0xb1cc AAAA cs9.wac.phicdn.net SOA ns1.edgecastcdn.net
  336 240.090941997     10.0.2.4 → 117.18.237.29 TCP 74 42500 → 80 [SYN] Seq=0 Win=64240 Len=0 MSS=1460 SACK_PERM=1 TSval=2834649521 TSecr=0 WS=128
  337 240.135898144      8.8.8.8 → 10.0.2.4     DNS 93 Standard query response 0x587e No such name PTR 15.2.0.10.in-addr.arpa OPT
  338 240.135947313     10.0.2.4 → 8.8.8.8      ICMP 121 Destination unreachable (Port unreachable)
  339 240.157109254      8.8.8.8 → 10.0.2.4     DNS 105 Standard query response 0x1e68 A cs9.wac.phicdn.net A 117.18.237.29 OPT
  340 240.157154789     10.0.2.4 → 8.8.8.8      ICMP 133 Destination unreachable (Port unreachable)
  341 240.157178489      8.8.8.8 → 10.0.2.4     DNS 185 Standard query response 0xe8fb AAAA ocsp.digicert.com CNAME cs9.wac.phicdn.net SOA ns1.edgecastcdn.net OPT
  342 240.157189694     10.0.2.4 → 8.8.8.8      ICMP 213 Destination unreachable (Port unreachable)
  343 240.157201291      8.8.8.8 → 10.0.2.4     DNS 157 Standard query response 0x19df AAAA cs9.wac.phicdn.net SOA ns1.edgecastcdn.net OPT
  344 240.157209983     10.0.2.4 → 8.8.8.8      ICMP 185 Destination unreachable (Port unreachable)
  345 240.172350517      8.8.8.8 → 10.0.2.4     DNS 136 Standard query response 0xa48a A ocsp.digicert.com CNAME cs9.wac.phicdn.net A 117.18.237.29 OPT
  346 240.172384288     10.0.2.4 → 8.8.8.8      ICMP 164 Destination unreachable (Port unreachable)
  347 240.176012399    10.0.2.15 → 10.0.2.4     TCP 74 44482 → 8888 [SYN] Seq=0 Win=64240 Len=0 MSS=1460 SACK_PERM=1 TSval=617091142 TSecr=0 WS=128
  348 240.176041878     10.0.2.4 → 10.0.2.15    TCP 74 8888 → 44482 [SYN, ACK] Seq=0 Ack=1 Win=65160 Len=0 MSS=1460 SACK_PERM=1 TSval=4118034708 TSecr=617091142 WS=128
  349 240.176365976    10.0.2.15 → 10.0.2.4     TCP 66 44482 → 8888 [ACK] Seq=1 Ack=1 Win=64256 Len=0 TSval=617091142 TSecr=4118034708
  350 240.176607984    10.0.2.15 → 10.0.2.4     OCSP 461 Request
  351 240.176618353     10.0.2.4 → 10.0.2.15    TCP 66 8888 → 44482 [ACK] Seq=1 Ack=396 Win=64768 Len=0 TSval=4118034709 TSecr=617091142
  352 240.176889745     10.0.2.4 → 8.8.8.8      DNS 93 Standard query 0x9891 PTR 15.2.0.10.in-addr.arpa OPT
  353 240.181195906     10.0.2.4 → 8.8.8.8      DNS 88 Standard query 0x6521 A ocsp.digicert.com OPT
  354 240.181355534     10.0.2.4 → 8.8.8.8      DNS 89 Standard query 0x12c7 A cs9.wac.phicdn.net OPT
  355 240.181522198     10.0.2.4 → 8.8.8.8      DNS 88 Standard query 0x62d9 AAAA ocsp.digicert.com OPT
  356 240.181672650     10.0.2.4 → 8.8.8.8      DNS 89 Standard query 0x8632 AAAA cs9.wac.phicdn.net OPT
  357 240.181810908     10.0.2.4 → 117.18.237.29 TCP 74 42502 → 80 [SYN] Seq=0 Win=64240 Len=0 MSS=1460 SACK_PERM=1 TSval=2834649612 TSecr=0 WS=128
  358 240.257854129      8.8.8.8 → 10.0.2.4     DNS 136 Standard query response 0x6521 A ocsp.digicert.com CNAME cs9.wac.phicdn.net A 117.18.237.29 OPT
  359 240.257907843     10.0.2.4 → 8.8.8.8      ICMP 164 Destination unreachable (Port unreachable)
  360 240.257941537      8.8.8.8 → 10.0.2.4     DNS 157 Standard query response 0x8632 AAAA cs9.wac.phicdn.net SOA ns1.edgecastcdn.net OPT
  361 240.268273680      8.8.8.8 → 10.0.2.4     DNS 93 Standard query response 0x9891 No such name PTR 15.2.0.10.in-addr.arpa OPT
  362 240.269166148      8.8.8.8 → 10.0.2.4     DNS 105 Standard query response 0x12c7 A cs9.wac.phicdn.net A 117.18.237.29 OPT
  363 240.269638108      8.8.8.8 → 10.0.2.4     DNS 185 Standard query response 0x62d9 AAAA ocsp.digicert.com CNAME cs9.wac.phicdn.net SOA ns1.edgecastcdn.net OPT
  364 240.447244224 117.18.237.29 → 10.0.2.4     TCP 60 80 → 42502 [SYN, ACK] Seq=0 Ack=1 Win=32768 Len=0 MSS=1460
  365 240.447278324     10.0.2.4 → 117.18.237.29 TCP 54 42502 → 80 [ACK] Seq=1 Ack=1 Win=64240 Len=0
  366 240.450427525     10.0.2.4 → 117.18.237.29 TCP 115 POST / HTTP/1.0  [TCP segment of a reassembled PDU]
  367 240.617816520 117.18.237.29 → 10.0.2.4     TCP 60 80 → 42502 [ACK] Seq=1 Ack=62 Win=32707 Len=0
  368 240.617856026     10.0.2.4 → 117.18.237.29 OCSP 397 Request
  369 240.870204840 117.18.237.29 → 10.0.2.4     TCP 60 80 → 42502 [ACK] Seq=1 Ack=405 Win=32364 Len=0
  370 241.091758329     10.0.2.4 → 117.18.237.29 TCP 74 [TCP Retransmission] 42500 → 80 [SYN] Seq=0 Win=64240 Len=0 MSS=1460 SACK_PERM=1 TSval=2834650522 TSecr=0 WS=128
  371 241.350567099 117.18.237.29 → 10.0.2.4     TCP 60 80 → 42500 [SYN, ACK] Seq=0 Ack=1 Win=32768 Len=0 MSS=1460
  372 241.350668367     10.0.2.4 → 117.18.237.29 TCP 54 42500 → 80 [ACK] Seq=1 Ack=1 Win=64240 Len=0
  373 241.364615997     10.0.2.4 → 117.18.237.29 TCP 115 POST / HTTP/1.0  [TCP segment of a reassembled PDU]
  374 241.373014870 117.18.237.29 → 10.0.2.4     TCP 60 80 → 42500 [ACK] Seq=1 Ack=62 Win=32707 Len=0
  375 241.373048092     10.0.2.4 → 117.18.237.29 OCSP 397 Request
  376 241.587714288     10.0.2.4 → 117.18.237.29 TCP 397 [TCP Retransmission] 42500 → 80 [PSH, ACK] Seq=62 Ack=1 Win=64240 Len=343
  377 241.587991689 117.18.237.29 → 10.0.2.4     TCP 60 80 → 42500 [ACK] Seq=1 Ack=405 Win=32364 Len=0
  378 241.627259054 117.18.237.29 → 10.0.2.4     OCSP 872 Response
  379 241.627281707     10.0.2.4 → 117.18.237.29 TCP 54 42500 → 80 [ACK] Seq=405 Ack=819 Win=63804 Len=0
  380 241.627537843 117.18.237.29 → 10.0.2.4     TCP 60 80 → 42500 [FIN, ACK] Seq=819 Ack=405 Win=32364 Len=0
  381 241.627565188     10.0.2.4 → 10.0.2.15    TCP 83 HTTP/1.0 200 OK  [TCP segment of a reassembled PDU]
  382 241.627618854     10.0.2.4 → 10.0.2.15    OCSP 886 Response
  383 241.628190590    10.0.2.15 → 10.0.2.4     TCP 66 44480 → 8888 [ACK] Seq=396 Ack=18 Win=64256 Len=0 TSval=617092595 TSecr=4118036160
  384 241.628211055    10.0.2.15 → 10.0.2.4     TCP 66 44480 → 8888 [ACK] Seq=396 Ack=839 Win=64128 Len=0 TSval=617092595 TSecr=4118036160
  385 241.628486076    10.0.2.15 → 10.0.2.4     TCP 66 44480 → 8888 [FIN, ACK] Seq=396 Ack=839 Win=64128 Len=0 TSval=617092595 TSecr=4118036160
  386 241.628746594     10.0.2.4 → 10.0.2.15    TCP 66 8888 → 44480 [ACK] Seq=839 Ack=397 Win=64768 Len=0 TSval=4118036161 TSecr=617092595
  387 241.630692381    10.0.2.15 → 10.0.2.4     TCP 74 44484 → 8888 [SYN] Seq=0 Win=64240 Len=0 MSS=1460 SACK_PERM=1 TSval=617092597 TSecr=0 WS=128
  388 241.630718833     10.0.2.4 → 10.0.2.15    TCP 74 8888 → 44484 [SYN, ACK] Seq=0 Ack=1 Win=65160 Len=0 MSS=1460 SACK_PERM=1 TSval=4118036163 TSecr=617092597 WS=128
  389 241.631097351    10.0.2.15 → 10.0.2.4     TCP 66 44484 → 8888 [ACK] Seq=1 Ack=1 Win=64256 Len=0 TSval=617092598 TSecr=4118036163
  390 241.631146675    10.0.2.15 → 10.0.2.4     OCSP 461 Request
  391 241.631152570     10.0.2.4 → 10.0.2.15    TCP 66 8888 → 44484 [ACK] Seq=1 Ack=396 Win=64768 Len=0 TSval=4118036163 TSecr=617092598
  392 241.631558444     10.0.2.4 → 8.8.8.8      DNS 93 Standard query 0x3c27 PTR 15.2.0.10.in-addr.arpa OPT
  393 241.638939698     10.0.2.4 → 117.18.237.29 TCP 54 42500 → 80 [FIN, ACK] Seq=405 Ack=820 Win=63804 Len=0
  394 241.639360996 117.18.237.29 → 10.0.2.4     TCP 60 80 → 42500 [ACK] Seq=820 Ack=406 Win=32363 Len=0
  395 241.642163162     10.0.2.4 → 8.8.8.8      DNS 88 Standard query 0x5608 A ocsp.digicert.com OPT
  396 241.642350041     10.0.2.4 → 8.8.8.8      DNS 89 Standard query 0xa7f1 A cs9.wac.phicdn.net OPT
  397 241.642546993     10.0.2.4 → 8.8.8.8      DNS 88 Standard query 0xc449 AAAA ocsp.digicert.com OPT
  398 241.642771825     10.0.2.4 → 8.8.8.8      DNS 89 Standard query 0x5769 AAAA cs9.wac.phicdn.net OPT
  399 241.642882723     10.0.2.4 → 117.18.237.29 TCP 74 42504 → 80 [SYN] Seq=0 Win=64240 Len=0 MSS=1460 SACK_PERM=1 TSval=2834651073 TSecr=0 WS=128
  400 241.724454290      8.8.8.8 → 10.0.2.4     DNS 93 Standard query response 0x3c27 No such name PTR 15.2.0.10.in-addr.arpa OPT
  401 241.724486244     10.0.2.4 → 8.8.8.8      ICMP 121 Destination unreachable (Port unreachable)
  402 241.729241994      8.8.8.8 → 10.0.2.4     DNS 157 Standard query response 0x5769 AAAA cs9.wac.phicdn.net SOA ns1.edgecastcdn.net OPT
  403 241.741618500      8.8.8.8 → 10.0.2.4     DNS 136 Standard query response 0x5608 A ocsp.digicert.com CNAME cs9.wac.phicdn.net A 117.18.237.29 OPT
  404 241.741638528      8.8.8.8 → 10.0.2.4     DNS 185 Standard query response 0xc449 AAAA ocsp.digicert.com CNAME cs9.wac.phicdn.net SOA ns1.edgecastcdn.net OPT
  405 241.755393367      8.8.8.8 → 10.0.2.4     DNS 105 Standard query response 0xa7f1 A cs9.wac.phicdn.net A 117.18.237.29 OPT
  406 241.878419282 117.18.237.29 → 10.0.2.4     TCP 60 80 → 42504 [SYN, ACK] Seq=0 Ack=1 Win=32768 Len=0 MSS=1460
  407 241.878470743     10.0.2.4 → 117.18.237.29 TCP 54 42504 → 80 [ACK] Seq=1 Ack=1 Win=64240 Len=0
  408 241.890103465     10.0.2.4 → 117.18.237.29 TCP 115 POST / HTTP/1.0  [TCP segment of a reassembled PDU]
  409 242.071476252 117.18.237.29 → 10.0.2.4     OCSP 872 Response
  410 242.071508749     10.0.2.4 → 117.18.237.29 TCP 54 42502 → 80 [ACK] Seq=405 Ack=819 Win=63804 Len=0
  411 242.071526148 117.18.237.29 → 10.0.2.4     TCP 60 80 → 42502 [FIN, ACK] Seq=819 Ack=405 Win=32364 Len=0
  412 242.071758891     10.0.2.4 → 10.0.2.15    TCP 83 HTTP/1.0 200 OK  [TCP segment of a reassembled PDU]
  413 242.071878071     10.0.2.4 → 10.0.2.15    OCSP 886 Response
  414 242.072201321    10.0.2.15 → 10.0.2.4     TCP 66 44482 → 8888 [ACK] Seq=396 Ack=18 Win=64256 Len=0 TSval=617093039 TSecr=4118036604
  415 242.072287422    10.0.2.15 → 10.0.2.4     TCP 66 44482 → 8888 [ACK] Seq=396 Ack=839 Win=64128 Len=0 TSval=617093039 TSecr=4118036604
  416 242.072731425    10.0.2.15 → 10.0.2.4     TCP 66 44482 → 8888 [FIN, ACK] Seq=396 Ack=839 Win=64128 Len=0 TSval=617093039 TSecr=4118036604
  417 242.072747843     10.0.2.4 → 10.0.2.15    TCP 66 8888 → 44482 [ACK] Seq=839 Ack=397 Win=64768 Len=0 TSval=4118036605 TSecr=617093039
  418 242.075131775     10.0.2.4 → 117.18.237.29 TCP 54 42502 → 80 [FIN, ACK] Seq=405 Ack=820 Win=63804 Len=0
  419 242.075198766    10.0.2.15 → 10.0.2.4     TCP 74 44486 → 8888 [SYN] Seq=0 Win=64240 Len=0 MSS=1460 SACK_PERM=1 TSval=617093042 TSecr=0 WS=128
  420 242.075224576     10.0.2.4 → 10.0.2.15    TCP 74 8888 → 44486 [SYN, ACK] Seq=0 Ack=1 Win=65160 Len=0 MSS=1460 SACK_PERM=1 TSval=4118036607 TSecr=617093042 WS=128
  421 242.075516108    10.0.2.15 → 10.0.2.4     TCP 66 44486 → 8888 [ACK] Seq=1 Ack=1 Win=64256 Len=0 TSval=617093042 TSecr=4118036607
  422 242.075554468 117.18.237.29 → 10.0.2.4     TCP 60 80 → 42502 [ACK] Seq=820 Ack=406 Win=32363 Len=0
  423 242.075672020    10.0.2.15 → 10.0.2.4     OCSP 461 Request
  424 242.075682919     10.0.2.4 → 10.0.2.15    TCP 66 8888 → 44486 [ACK] Seq=1 Ack=396 Win=64768 Len=0 TSval=4118036608 TSecr=617093042
  425 242.076174899     10.0.2.4 → 8.8.8.8      DNS 93 Standard query 0xd094 PTR 15.2.0.10.in-addr.arpa OPT
  426 242.080826575     10.0.2.4 → 8.8.8.8      DNS 88 Standard query 0xe00b A ocsp.digicert.com OPT
  427 242.081063313     10.0.2.4 → 8.8.8.8      DNS 89 Standard query 0x27a8 A cs9.wac.phicdn.net OPT
  428 242.081312354     10.0.2.4 → 8.8.8.8      DNS 88 Standard query 0x1eb8 AAAA ocsp.digicert.com OPT
  429 242.081547465     10.0.2.4 → 8.8.8.8      DNS 89 Standard query 0xca3b AAAA cs9.wac.phicdn.net OPT
  430 242.081747341     10.0.2.4 → 117.18.237.29 TCP 74 42506 → 80 [SYN] Seq=0 Win=64240 Len=0 MSS=1460 SACK_PERM=1 TSval=2834651512 TSecr=0 WS=128
  431 242.134931283 117.18.237.29 → 10.0.2.4     TCP 60 80 → 42504 [ACK] Seq=1 Ack=62 Win=32707 Len=0
  432 242.135004970     10.0.2.4 → 117.18.237.29 OCSP 397 Request
  433 242.185974836      8.8.8.8 → 10.0.2.4     DNS 136 Standard query response 0xe00b A ocsp.digicert.com CNAME cs9.wac.phicdn.net A 117.18.237.29 OPT
  434 242.186045861     10.0.2.4 → 8.8.8.8      ICMP 164 Destination unreachable (Port unreachable)
  435 242.187441094      8.8.8.8 → 10.0.2.4     DNS 185 Standard query response 0x1eb8 AAAA ocsp.digicert.com CNAME cs9.wac.phicdn.net SOA ns1.edgecastcdn.net OPT
  436 242.188915574      8.8.8.8 → 10.0.2.4     DNS 157 Standard query response 0xca3b AAAA cs9.wac.phicdn.net SOA ns1.edgecastcdn.net OPT
  437 242.199588488      8.8.8.8 → 10.0.2.4     DNS 93 Standard query response 0xd094 No such name PTR 15.2.0.10.in-addr.arpa OPT
  438 242.199632204      8.8.8.8 → 10.0.2.4     DNS 105 Standard query response 0x27a8 A cs9.wac.phicdn.net A 117.18.237.29 OPT
  439 242.334697399 117.18.237.29 → 10.0.2.4     TCP 60 80 → 42506 [SYN, ACK] Seq=0 Ack=1 Win=32768 Len=0 MSS=1460
  440 242.334757043     10.0.2.4 → 117.18.237.29 TCP 54 42506 → 80 [ACK] Seq=1 Ack=1 Win=64240 Len=0
  441 242.346824957     10.0.2.4 → 117.18.237.29 TCP 115 POST / HTTP/1.0  [TCP segment of a reassembled PDU]
  442 242.387585305 117.18.237.29 → 10.0.2.4     TCP 60 80 → 42506 [ACK] Seq=1 Ack=62 Win=32707 Len=0
  443 242.387609932     10.0.2.4 → 117.18.237.29 OCSP 397 Request
  444 242.387623277 117.18.237.29 → 10.0.2.4     TCP 60 80 → 42504 [ACK] Seq=1 Ack=405 Win=32364 Len=0
  445 242.637551725 117.18.237.29 → 10.0.2.4     TCP 60 80 → 42506 [ACK] Seq=1 Ack=405 Win=32364 Len=0
  446 242.699608791 117.18.237.29 → 10.0.2.4     OCSP 872 Response
  447 242.699667046     10.0.2.4 → 117.18.237.29 TCP 54 42504 → 80 [ACK] Seq=405 Ack=819 Win=63804 Len=0
  448 242.699885194     10.0.2.4 → 10.0.2.15    TCP 83 HTTP/1.0 200 OK  [TCP segment of a reassembled PDU]
  449 242.700009218     10.0.2.4 → 10.0.2.15    OCSP 886 Response
  450 242.700151469 117.18.237.29 → 10.0.2.4     TCP 60 80 → 42504 [FIN, ACK] Seq=819 Ack=405 Win=32364 Len=0
  451 242.700338545    10.0.2.15 → 10.0.2.4     TCP 66 44484 → 8888 [ACK] Seq=396 Ack=18 Win=64256 Len=0 TSval=617093667 TSecr=4118037232
  452 242.700614982    10.0.2.15 → 10.0.2.4     TCP 66 44484 → 8888 [ACK] Seq=396 Ack=839 Win=64128 Len=0 TSval=617093667 TSecr=4118037232
  453 242.700864597    10.0.2.15 → 10.0.2.4     TCP 66 44484 → 8888 [FIN, ACK] Seq=396 Ack=839 Win=64128 Len=0 TSval=617093668 TSecr=4118037232
  454 242.700876366     10.0.2.4 → 10.0.2.15    TCP 66 8888 → 44484 [ACK] Seq=839 Ack=397 Win=64768 Len=0 TSval=4118037233 TSecr=617093668
  455 242.713350723     10.0.2.4 → 117.18.237.29 TCP 54 42504 → 80 [FIN, ACK] Seq=405 Ack=820 Win=63804 Len=0
  456 242.713723586 117.18.237.29 → 10.0.2.4     TCP 60 80 → 42504 [ACK] Seq=820 Ack=406 Win=32363 Len=0
  457 243.974184866 117.18.237.29 → 10.0.2.4     OCSP 872 Response
  458 243.974264963     10.0.2.4 → 117.18.237.29 TCP 54 42506 → 80 [ACK] Seq=405 Ack=819 Win=63804 Len=0
  459 243.974313401 117.18.237.29 → 10.0.2.4     TCP 60 80 → 42506 [FIN, ACK] Seq=819 Ack=405 Win=32364 Len=0
  460 243.974931091     10.0.2.4 → 10.0.2.15    TCP 83 HTTP/1.0 200 OK  [TCP segment of a reassembled PDU]
  461 243.975303736     10.0.2.4 → 10.0.2.15    OCSP 886 Response
  462 243.976089332    10.0.2.15 → 10.0.2.4     TCP 66 44486 → 8888 [ACK] Seq=396 Ack=18 Win=64256 Len=0 TSval=617094943 TSecr=4118038507
  463 243.976491994    10.0.2.15 → 10.0.2.4     TCP 66 44486 → 8888 [ACK] Seq=396 Ack=839 Win=64128 Len=0 TSval=617094944 TSecr=4118038507
  464 243.977281954    10.0.2.15 → 10.0.2.4     TCP 66 44486 → 8888 [FIN, ACK] Seq=396 Ack=839 Win=64128 Len=0 TSval=617094945 TSecr=4118038507
  465 243.977319236     10.0.2.4 → 10.0.2.15    TCP 66 8888 → 44486 [ACK] Seq=839 Ack=397 Win=64768 Len=0 TSval=4118038509 TSecr=617094945
  466 243.988881519     10.0.2.4 → 117.18.237.29 TCP 54 42506 → 80 [FIN, ACK] Seq=405 Ack=820 Win=63804 Len=0
  467 243.989290991 117.18.237.29 → 10.0.2.4     TCP 60 80 → 42506 [ACK] Seq=820 Ack=406 Win=32363 Len=0
